### ISSUE TITLE
Silence in incoming RTP stream

### ISSUE THREAD

**Issue by voransoy** [OpenSIPS/opensips-ai-voice-connector-ce#3]
Hi there

I wanted to give  a try this on my lab and have an issue with conversation. I see that my speech is recognized and there is an RTP traffic between endpoints.  But the inbound RTP has silence in it. How can I debug this issue? Here is a sample log. 

```
root@opensips-demo:~/opensips-ai-voice-connector-ce/src# python3 -u main.py -c config.ini
2024-12-29 16:38:10,534 - tid: 133675876115136 - INFO - Starting server at 127.0.0.1:50060
2024-12-29 16:38:27,856 - tid: 133675876115136 - INFO - Bound to 192.168.201.126:35317
2024-12-29 16:38:27,856 - tid: 133675876115136 - INFO - handling B2B.399.192.1735490307.224955111 using openai AI
2024-12-29 16:38:28,958 - tid: 133675876115136 - INFO - session.updated
2024-12-29 16:38:28,958 - tid: 133675876115136 - INFO - response.created
2024-12-29 16:38:29,212 - tid: 133675876115136 - INFO - response.done
2024-12-29 16:38:29,885 - tid: 133675876115136 - INFO - input_audio_buffer.speech_started
2024-12-29 16:38:30,507 - tid: 133675876115136 - INFO - input_audio_buffer.speech_stopped
2024-12-29 16:38:30,508 - tid: 133675876115136 - INFO - input_audio_buffer.committed
2024-12-29 16:38:30,519 - tid: 133675876115136 - INFO - response.created
2024-12-29 16:38:30,581 - tid: 133675876115136 - INFO - response.done
2024-12-29 16:38:31,296 - tid: 133675876115136 - INFO - Speaker: Hello.
2024-12-29 16:38:33,499 - tid: 133675876115136 - INFO - input_audio_buffer.speech_started
2024-12-29 16:38:34,137 - tid: 133675876115136 - INFO - input_audio_buffer.speech_stopped
2024-12-29 16:38:34,140 - tid: 133675876115136 - INFO - input_audio_buffer.committed
2024-12-29 16:38:34,154 - tid: 133675876115136 - INFO - response.created
2024-12-29 16:38:34,205 - tid: 133675876115136 - INFO - response.done
2024-12-29 16:38:35,234 - tid: 133675876115136 - INFO - Speaker: Can you hear me?
2024-12-29 16:38:42,228 - tid: 133675876115136 - INFO - Call B2B.399.192.1735490307.224955111 closing
```

RTP traffic:

```
16:38:42.054372 IP 192.168.201.126.35317 > 172.16.254.2.23918: UDP, length 172
16:38:42.075469 IP 192.168.201.126.35317 > 172.16.254.2.23918: UDP, length 172
16:38:42.094873 IP 192.168.201.126.35317 > 172.16.254.2.23918: UDP, length 172
16:38:42.114274 IP 192.168.201.126.35317 > 172.16.254.2.23918: UDP, length 172
16:38:42.134672 IP 192.168.201.126.35317 > 172.16.254.2.23918: UDP, length 172
16:38:42.154021 IP 192.168.201.126.35317 > 172.16.254.2.23918: UDP, length 172
16:38:42.174439 IP 192.168.201.126.35317 > 172.16.254.2.23918: UDP, length 172
16:38:42.181506 IP 172.16.254.2.23918 > 192.168.201.126.35317: UDP, length 172
16:38:42.181509 IP 172.16.254.2.23918 > 192.168.201.126.35317: UDP, length 172
16:38:42.181512 IP 172.16.254.2.23918 > 192.168.201.126.35317: UDP, length 172
16:38:42.181515 IP 172.16.254.2.23918 > 192.168.201.126.35317: UDP, length 172
16:38:42.181518 IP 172.16.254.2.23918 > 192.168.201.126.35317: UDP, length 172
16:38:42.181521 IP 172.16.254.2.23918 > 192.168.201.126.35317: UDP, length 172
16:38:42.194629 IP 192.168.201.126.35317 > 172.16.254.2.23918: UDP, length 172
16:38:42.215032 IP 192.168.201.126.35317 > 172.16.254.2.23918: UDP, length 172
```

**Comment by voransoy** [comment]
my fault, it was a deepgram api key issue. :)
